URL,Feedback
https://ramrajcotton.in/pages/store-reviews,Comfortable & durable
https://ramrajcotton.in/pages/store-reviews,Really good quality hankey.
https://ramrajcotton.in/pages/store-reviews,"I had been using Ramraj Cotton product for long time since my buisness trip to Chennai two decades ago from Calcutta.Excellent quality, pure cotton and extremely comfortable to wear .I strongly recommend for these products manufactured and marketed by them ."
https://ramrajcotton.in/pages/store-reviews,best saree of ramaraj
https://ramrajcotton.in/pages/store-reviews,Thank you for providing this wonderful shirtReally great
https://ramrajcotton.in/pages/store-reviews,Hand carchifs are of fine fabric and have a touch of class.
https://ramrajcotton.in/pages/store-reviews,"They were such vibrant colours, beautiful designs and patterns"
https://ramrajcotton.in/pages/store-reviews,Soft fabric & perfect fitting
https://ramrajcotton.in/pages/store-reviews,Best productSoft fabric
https://ramrajcotton.in/pages/store-reviews,Very nice and comfortable
https://ramrajcotton.in/pages/store-reviews,I am very happy to wear this product.very good product
https://ramrajcotton.in/pages/store-reviews,Quality product.l really liked it.Perfect fit.
https://ramrajcotton.in/pages/store-reviews,Very Good Product. There is not doubt of Quality of Ramraj Vest. I am using many years. before i was buying from local shops. not they dont keep this brand. so i am purchasing online. Thanks You RAMRAJ for giving Quality Product.
https://ramrajcotton.in/pages/store-reviews,Nice material and colour
https://ramrajcotton.in/pages/store-reviews,The product recieved is well packed and good
https://ramrajcotton.in/pages/store-reviews,"Last two years I have been using white shirts , excellent quality in economic price ."
https://ramrajcotton.in/pages/store-reviews,NICE FIT AND GOOD QUALITY !
