URL,Feedback
https://judge.me/reviews/stores/ramrajcotton.in/products/bamboo-cotton-white-shirt-soft-breathable-eco-friendly,Shipped from by Ramraj Cotton
https://judge.me/reviews/stores/ramrajcotton.in/products/bamboo-cotton-white-shirt-soft-breathable-eco-friendly,Looks best Feel best Stitching best Comfort best Cost BEST A best white shirt
https://judge.me/reviews/stores/ramrajcotton.in/products/bamboo-cotton-white-shirt-soft-breathable-eco-friendly,"Well, I'm extremely satisfied with the bamboo based fabric, which is soft and comfortable to wear all day, especially at higher temperatures in the summer."
https://judge.me/reviews/stores/ramrajcotton.in/products/bamboo-cotton-white-shirt-soft-breathable-eco-friendly,Nice material. Bamboo cotton
https://judge.me/reviews/stores/ramrajcotton.in/products/bamboo-cotton-white-shirt-soft-breathable-eco-friendly,"Got 2 shirts initially, then 2 more. The bamboo cotton shirt (white) is just superb. It is so soft & durable, feels very comfortable and in my opinion one of the best shirts I have had."
https://judge.me/reviews/stores/ramrajcotton.in/products/bamboo-cotton-white-shirt-soft-breathable-eco-friendly,"Still getting the hang of the sizes, one 40 fits & one 42. But that's ok, as the shirts are fab."
https://judge.me/reviews/stores/ramrajcotton.in/products/bamboo-cotton-white-shirt-soft-breathable-eco-friendly,A fan of Ramraj. Thanks to a friend who introduced me.
https://judge.me/reviews/stores/ramrajcotton.in/products/bamboo-cotton-white-shirt-soft-breathable-eco-friendly,I really liked the shirt and it's fabric
https://judge.me/reviews/stores/ramrajcotton.in/products/bamboo-cotton-white-shirt-soft-breathable-eco-friendly,Satisfying experience
https://judge.me/reviews/stores/ramrajcotton.in/products/bamboo-cotton-white-shirt-soft-breathable-eco-friendly,good fabric under reasonable price and fitting is also good.
https://judge.me/reviews/stores/ramrajcotton.in/products/bamboo-cotton-white-shirt-soft-breathable-eco-friendly,Our system prevents spam reviews from being displayed.
https://judge.me/reviews/stores/ramrajcotton.in/products/bamboo-cotton-white-shirt-soft-breathable-eco-friendly,Trusted reviews are marked with the verified label.
https://judge.me/reviews/stores/ramrajcotton.in/products/bamboo-cotton-white-shirt-soft-breathable-eco-friendly,Our medals celebrate stores that are open with their customers.
https://judge.me/reviews/stores/ramrajcotton.in/products/bamboo-cotton-white-shirt-soft-breathable-eco-friendly,Company Registration Number: 12157706
https://judge.me/reviews/stores/ramrajcotton.in/products/newborn-baby-traditional-set-cream-1,"Nice cloth,Such a very nice I really can't believe this"
https://judge.me/reviews/stores/ramrajcotton.in/products/ultra-soft-quick-absorbent-bamboo-assorted-colours-bath-towel,"I am very happy to use Ramraj Bamboo Fibre made Towels, quality is very nice , good water absorbing fabric. I am satisfied and would recommend everyone to must try this for once. thanks...."
https://judge.me/reviews/stores/ramrajcotton.in/products/ultra-soft-quick-absorbent-bamboo-assorted-colours-bath-towel,"I am very happy to use Ramraj Bamboo Fibre made Towels, the quality is very satisfying, full orf cozy and good water absorbing fabric. I am satisfied and would recommend everyone to must try this for once."
https://judge.me/reviews/stores/ramrajcotton.in/products/ultra-soft-quick-absorbent-bamboo-assorted-colours-bath-towel,Received the towels its so soft and soo good to use the to RamRaj
https://judge.me/reviews/stores/ramrajcotton.in/products/ultra-soft-quick-absorbent-bamboo-assorted-colours-bath-towel,Quick absorb and love the fabric
https://judge.me/reviews/stores/ramrajcotton.in/products/ultra-soft-quick-absorbent-bamboo-assorted-colours-bath-towel,Full size and quality superb
https://judge.me/reviews/stores/ramrajcotton.in/products/ultra-soft-quick-absorbent-bamboo-assorted-colours-bath-towel,Towel is so soft and lightweight. Happy customer
https://judge.me/reviews/stores/ramrajcotton.in/products/ultra-soft-quick-absorbent-bamboo-assorted-colours-bath-towel,"When I used this towel, I felt it was very soft. It's so soft that we can use it after washing it. It's a good item."
https://judge.me/reviews/stores/ramrajcotton.in/products/100-combed-cotton-white-vest-rn-sukra-pack-of-2,"I had a very good experience, the quality of the order is also very good, the customer support is also very good, when I saw it for the first time I ordered it and now I have ordered it again, very good brand"
https://judge.me/reviews/stores/ramrajcotton.in/products/100-combed-cotton-white-vest-rn-sukra-pack-of-2,"Very Soft very good quality cotton. First I brought 1 pc from offline Bangalore majestic store, I found very good, then I ordered 4 pc online as I stay haryana. They have good bamboo soft towel n hankey , saari, shirt, dhoti cotton n linen also. I brought from offline."
https://judge.me/reviews/stores/ramrajcotton.in/products/100-combed-cotton-white-vest-rn-sukra-pack-of-2,One of the best quality product exceeding Expectations of customers. The Servises are fentastic. I am impressed
https://judge.me/reviews/stores/ramrajcotton.in/products/100-combed-cotton-white-vest-rn-sukra-pack-of-2,"Very very comfortable material,and i m satisfied with your product,i will be using your product for lifetime if you maintain the same quality."
https://judge.me/reviews/stores/ramrajcotton.in/products/100-combed-cotton-white-vest-rn-sukra-pack-of-2,Comfortable & durable
https://judge.me/reviews/stores/ramrajcotton.in/products/100-combed-cotton-white-vest-rn-sukra-pack-of-2,Very Good Product. There is not doubt of Quality of Ramraj Vest. I am using many years. before i was buying from local shops. not they dont keep this brand. so i am purchasing online. Thanks You RAMRAJ for giving Quality Product.
https://judge.me/reviews/stores/ramrajcotton.in/products/100-combed-cotton-white-vest-rn-sukra-pack-of-2,Nice fitting and fabric
https://judge.me/reviews/stores/ramrajcotton.in/products/100-combed-cotton-white-vest-rn-sukra-pack-of-2,Innerwears are of best quality. Fabric is purely cotton. Thanks Ramraj
https://judge.me/reviews/stores/ramrajcotton.in/products/100-combed-cotton-white-vest-rn-sukra-pack-of-2,"as i have used this item, i would suggest to buy again and again"
https://judge.me/reviews/stores/ramrajcotton.in/products/cotton-premium-soft-feel-white-bath-towel-1046-pack-of-2,"I,ll use first time Ramraj cotton after wear of fabric I'm surprised their finish and premium quality"
https://ramrajcotton.in/pages/store-reviews,Really good quality hankey.
https://ramrajcotton.in/pages/store-reviews,Excellent cotton product
https://ramrajcotton.in/pages/store-reviews,"I had been using Ramraj Cotton product for long time since my buisness trip to Chennai two decades ago from Calcutta. Excellent quality, pure cotton and extremely comfortable to wear . I strongly recommend for these products manufactured and marketed by them ."
https://ramrajcotton.in/pages/store-reviews,best saree of ramaraj
https://ramrajcotton.in/pages/store-reviews,Wonderful experience
https://ramrajcotton.in/pages/store-reviews,Thank you for providing this wonderful shirt Really great
https://ramrajcotton.in/pages/store-reviews,Hand carchifs are of fine fabric and have a touch of class.
https://ramrajcotton.in/pages/store-reviews,"They were such vibrant colours, beautiful designs and patterns"
https://ramrajcotton.in/pages/store-reviews,Soft fabric & perfect fitting
https://ramrajcotton.in/pages/store-reviews,Best product Soft fabric
https://ramrajcotton.in/pages/store-reviews,Very nice and comfortable
https://ramrajcotton.in/pages/store-reviews,I am very happy to wear this product.very good product
https://ramrajcotton.in/pages/store-reviews,Quality product.l really liked it.Perfect fit.
https://ramrajcotton.in/pages/store-reviews,Thanks You RAMRAJ for giving Quality Product
https://ramrajcotton.in/pages/store-reviews,Nice material and colour
https://ramrajcotton.in/pages/store-reviews,The product recieved is well packed and good
https://ramrajcotton.in/pages/store-reviews,Blend of Best and Economic ....
https://ramrajcotton.in/pages/store-reviews,"Last two years I have been using white shirts , excellent quality in economic price ."
https://ramrajcotton.in/pages/store-reviews,NICE FIT AND GOOD QUALITY !
https://ramrajcotton.in/pages/store-reviews,© 2026 Ramraj Cotton
